{
  "_id": "5eb17ab3b69dc744b4e81942",
  "quoteText": "I think the thing we see is that as people are using video games more, they tend to watch passive TV a bit less. And so using the PC for the Internet, playing video games, is starting to cut into the rather unbelievable amount of time people spend watching TV.",
  "quoteAuthor": "Bill Gates",
  "quoteGenre": "time",
  "__v": 0
}
